{
  "approval": {
    "approval_source": "explicit-user",
    "approved_by": {
      "email": "ant_ant95@hotmail.it",
      "id": "antonioantenore",
      "name": "Antonio",
      "source": "cli",
      "type": "human"
    },
    "approved_content_hash": "3bc254ede7fd48340fe54d99f17b9177fa45b2ad2571d10eac4ea802269baa19",
    "authorization_action": null,
    "authorization_ref": null,
    "authorization_use_ref": null,
    "created_at": "2026-07-29T20:54:31.529Z",
    "evidence": [],
    "explicit_user_confirmation": true,
    "git": {
      "branch": "codex/local-project-hardening",
      "head_sha": "1b53a836134158e6fa852b0330ab125b00e37a2d",
      "is_dirty": true,
      "is_git_repo": true,
      "remotes": [
        "origin"
      ],
      "user": {
        "email": "ant_ant95@hotmail.it",
        "name": "Antonio Antenore"
      }
    },
    "hash_algorithm": "sha256:stable-json:v1",
    "id": "APR-20260729205431-024e6f",
    "provisional": false,
    "requirement_id": "REQ-ENTERPRISE-CONTROL-PLANE-001-R2",
    "run": {
      "run_id": null,
      "session_id": null,
      "thread_id": "019fa90d-8ff0-72e1-9bbd-739766a657cf",
      "tool": "agentic-sdlc-cli",
      "version": "0.13.5"
    },
    "scope": {
      "applies_only_to_presented_subject": true,
      "approval_level": "requirement-supersession",
      "does_not_approve_future_artifacts": true,
      "principle": "A human approval applies only to the specific artifact or decision shown to the user before the approval.",
      "requires_fresh_user_confirmation_for_new_artifacts": true,
      "subject_id": "REQ-ENTERPRISE-CONTROL-PLANE-001-R2",
      "subject_label": "supersession REQ-ENTERPRISE-CONTROL-PLANE-001-R2 -> REQ-ENTERPRISE-CONTROL-PLANE-001-R3"
    },
    "status": "approved",
    "summary": "Approved replacing R2 with the exact fixed runtime policy recorded in R3."
  },
  "audit": {
    "actor": {
      "email": "ant_ant95@hotmail.it",
      "id": "antonioantenore",
      "name": "Antonio",
      "source": "cli",
      "type": "human"
    },
    "git": {
      "branch": "codex/local-project-hardening",
      "head_sha": "1b53a836134158e6fa852b0330ab125b00e37a2d",
      "is_dirty": true,
      "is_git_repo": true,
      "remotes": [
        "origin"
      ],
      "user": {
        "email": "ant_ant95@hotmail.it",
        "name": "Antonio Antenore"
      }
    },
    "run": {
      "run_id": null,
      "session_id": null,
      "thread_id": "019fa90d-8ff0-72e1-9bbd-739766a657cf",
      "tool": "agentic-sdlc-cli",
      "version": "0.13.5"
    }
  },
  "created_at": "2026-07-29T20:54:31.529Z",
  "event": "superseded",
  "id": "REQ-SUP-20260729205431529-a7c82d",
  "kind": "requirement_lifecycle_event",
  "reason": "Node.js 18.18.0 is affected by the confirmed upstream shutdown livelock fixed in 18.20.3, so the old compatibility promise is not safely enforceable.",
  "replacement_ref": {
    "content_hash": "197dd066211fc2567c667758f388609d9aa37af4280eb225d463351ac91effb0",
    "id": "REQ-ENTERPRISE-CONTROL-PLANE-001-R3",
    "path": ".sdlc/requirements/REQ-ENTERPRISE-CONTROL-PLANE-001-R3.json",
    "revision": 3
  },
  "requirement_ref": {
    "content_hash": "5dcd3fbc53f37b6c079f926cf60cc5c417601461eb75be85287df32f9da553b7",
    "id": "REQ-ENTERPRISE-CONTROL-PLANE-001-R2",
    "path": ".sdlc/requirements/REQ-ENTERPRISE-CONTROL-PLANE-001-R2.json",
    "revision": 2
  },
  "schema_version": "requirement-lifecycle-event:v1"
}
